author,url,text,section,title,sub_title,date
Karen Luise Vilanova Batista de Souza Pinheiro,https://www.cartacapital.com.br/blogs/sororidade-em-pauta/uma-magistrada-negra-historia-e-um-judiciario-para-alem-da-excecao/,"
– Audre Lorde
 
 
Confesso que, ao longo de vinte anos de trabalho no Judiciário, nunca coloquei em evidência minha negritude publicamente –  a máscara do silêncio funcionou muito bem em mim. O debate sobre o racismo em nosso país sempre foi sufocado pelo discurso da democracia racial, que criou a percepção equivocada de convivência harmônica da população, encobrindo os motivos das desigualdades e impondo aos negros condutas o mais próximas possíveis do modo de ver e compreender o mundo sob a ótica do homem branco.
Talvez essa não fosse a melhor forma de iniciar esse texto, mas para uma boa compreensão sobre as ideias que carrego há importância em conhecer o fato que a seguir descrevo como um momento que marcou minha vida.
Eram meados da década de 90 e eu, uma jovem recém formada no curso de direito, trabalhava como assessora jurídica do serviço público municipal e vivia envolvida com os estudos. Certa tarde, apressadamente tomei o elevador da repartição e ali encontrei colegas que conversavam sobre os mais diversos assuntos. Aliás, aquele era um lugar interessante, pois o ascensor antigo subia lentamente, permitindo que falássemos sobre tudo, desde o cotidiano do trabalho, o tempo, a família, os amigos, a política, as notícias.
  Naquele dia, conversávamos sobre projetos profissionais e os livros que trazia chamaram atenção dos colegas presentes, que iniciaram uma série de perguntas, pretendendo saber do que tratavam e o que eu fazia com eles no serviço. De imediato contei que havia sido contemplada com uma bolsa na Escola Superior da Magistratura e, por isto, tinha retomado os estudos, pois pretendia ser juíza.
Completei dizendo que depois do trabalho partiria para o terceiro turno de atividades, o que importava em um sacrifício, mas tinha absoluta certeza de que valeria a pena, pois estava fazendo tudo o que se encontrava ao meu alcance para obter bons resultados.
Mulheres negras e indígenas protestam contra o racismo em São Paulo, em julho de 2017Percebi, então, que minhas explicações foram interrompidas por uma colega, que olhou para os demais e ironicamente exclamou: “Ela só quer ser juíza!!!”. Na sequência sorriu, depois gargalhou, provocando o riso geral nos presentes, que sem qualquer pudor desdenharam da minha pretensão. Sem jeito, encerrei ali o assunto, saí do elevador constrangida e pensativa sobre aquele episódio tão simbólico, repleto de significados e que transmitia uma mensagem muito clara.
Inconformada, perguntei-me: “Como ela poderia ter dito aquilo?”“Meu desejo não era legítimo?”, “Por que reagiram diferentemente aos projetos dos demais colegas?”De fato, o Poder Judiciário não se constituía em um espaço ocupado por mulheres pretas, principalmente em um Estado com mais de 80% da população branca.De fato, eu sequer possuía referências nesse sentido, pois não enxergava magistradas negras exercendo a jurisdição. O mundo direito ainda era predominantemente branco e masculino.
Já o mercado de trabalho para mulheres negras era outro. Elas permaneciam a lavar roupas, cozinhar, higienizar e zelar pelas residências alheias, em flagrante posição de subalternidade e sem as mínimas chances de ascender profissional e economicamente, seguindo uma história de invisibilidade, como seres humanos de segunda categoria, sujeitas à vontade do outro, que sempre determinou os modos de existência das mulheres no mundo. Essa era uma realidade que eu tentava negar, mas naquele dia as palavras, a exposição pública e, enfim, os risos pesaram.  Naquele dia saí do elevador, silenciosa, incomodada e ferida. Naquele dia as palavras doeram e eu, sozinha, chorei.
Chorei porque era uma mulher negra. Chorei porque aquelas palavras demonstravam o quanto a sociedade queria definir e limitar espaços, traçar a trajetória que deveria percorrer, negando a existência, condições de igualdade com os demais cidadãos e as capacidades que com absoluta certeza carregava, retirando-me o direito de ser a protagonista da minha própria história. A sociedade queria colonizar meus projetos, minhas aspirações, restringindo-os às estruturas estabelecidas, que tinham na cor da pele a fronteira que colocava a mulher negra na periferia dos desejos. Chorei porque a mim sequer era permitido sonhar.
Mas, como eu havia estudado em uma excelente escola particular, como fui professora aos 17 anos, aprovada em concurso público aos 18, tendo assim ingressado no mercado de trabalho com facilidade, tive renda própria, que aliada a auxílios financeiros e bolsas recebidas, passados pouco mais de três anos assumi como magistrada em uma pequena comarca do interior do Estado do Rio Grande do Sul, a única candidata negra dentre os 90 aprovados no certame, iniciando ali uma jornada, que embora não seja única revela-se singular.
Singular porque se trata ainda de uma exceção, que não deve servir como exemplo a ninguém, pois usufruí de alguns privilégios, colocada, portanto, em melhores condições de ingresso na carreira nesse sistema meritocrático, que não poderia ser sustentado em um país com tantas desigualdades como o Brasil.
Ao longo desses anos não foi fácil trabalhar em comunidades erigidas por intermédio da economia escravocrata, nas quais as riquezas foram acumuladas com a exploração da força de trabalho, dos corpos e das vidas de negros e negras.
Enfrentei a dura realidade de dizer o direito para quem há pouco mais de cem anos sequer reconhecia humanidade em indivíduos negros – os arranjos sociais consolidados ainda não permitem à sociedade enxergar-nos como sujeitos dos mesmos direitos, aptos ao exercício de função tão relevante como a da magistratura.
Não fosse assim, os espaços de poder estariam ocupados por homens e mulheres de todas as raças, com origem em todas as classes, sem que houvesse tamanha desproporcionalidade como a encontrada no Brasil onde apenas 1,6% dos juízes são pretos.
Não foram poucos os flagrantes de racismo encontrados nesse percurso, tanto nos cartórios, como nas salas de audiências, nos eventos públicos, em atos praticados por diferentes membros das carreiras jurídicas, que se surpreendiam com a imagem de uma mulher negra exercendo a jurisdição.
O estranhamento nas relações interpessoais sempre foi meu companheiro: houve quem perguntou onde estava a juíza, houve quem se dirigiu a todos presentes em sala de audiências menos a mim; houve quem disse que pensava em alguém diferente, ainda que eu estivesse ocupando o lugar de maior destaque do ambiente forense, o que demonstrava rejeição à figura de uma juíza de direito que ostentava uma representação não correspondente ao padrão construído no imaginário coletivo. Todos, de diferentes modos, mas por meio de códigos não falados revelaram o racismo em suas condutas.
Nessa caminhada fui compreendendo que as ascensões profissional e econômica nunca me retiraram da condição social que sempre ostentei enquanto mulher e negra.Ora, a vigilância nos estabelecimentos comerciais não cessou, a perseguição dos seguranças também não, as situações de constrangimento em espaços públicos permaneceram e, por óbvio, as dores e ressentimentos decorrentes dessas diferentes formas de violência são companheiras do dia-a-dia.
Hoje não tenho dúvidas de que o negro que ascende profissional e economicamente não carrega consigo como consequência lógica a ascensão social, pois na estrutura racializada em que vivemos a todo o tempo a sociedade procura o nosso erro, busca em que vamos vacilar, tentando remeter-nos ao lugar de onde, para ela, nunca deveríamos ter saído. Estamos sempre sendo colocados a prova quanto às nossas capacidades pela natural carga de inferiorização que carregamos.
E isso, por si só, da mesma forma traduz-se em violência, agressão, interferindo diretamente na forma como nos comportamos socialmente, seja pelo silêncio, seja pela não interação, seja pela não representação do nosso povo.  Por isso digo e repito, esteja onde eu estiver: a periferia está no meu corpo, a periferia está na cor da minha pele! A periferia está em mim!Em razão disso, diante de tantos flagrantes institucionais e cotidianos, preocupo-me em discutir a posição social de negros e negras, já que a raça é fator que define quem tem vantagens ou privilégios na sociedade.
Não é novidade que mulheres negras estão na base da pirâmide social, recebendo a pior remuneração por sua força de trabalho; que existe um verdadeiro extermínio de jovens negros; que a população negra é a que mais se encarcera no país, tudo resultado da extrema opressão social que lhes é imposta, por meio de políticas que não privilegiam investimentos em saúde, educação e não valorizam nem reparam os graves danos provocados a quem foi arrancado de sua terra mãe e aqui permaneceu, sem escolhas e oportunidades para uma existência digna e verdadeiramente livre.
Sinto-me, pois, falando como mulher negra, totalmente legitimada a pautar essas questões, tanto na sociedade como no Poder Judiciário, conclamando todos a refletirem nos mais diversos espaços sobre a temática racial em nosso país.
Como já dito, o Poder Judiciário possui 1,6% de juízes pretos. São apenas 16,6% juízes pardos, o que se traduz em verdadeira anomalia na medida em que a população brasileira não está devidamente representada. É preciso que se desnaturalize a ausência de pessoas negras nas mais diferentes esferas de poder, hoje regra na composição das carreiras jurídicas. Portanto, o debate e a reflexão provocados têm, por assim dizer, o objetivo de buscarem-se alternativas ao aprimoramento da prestação da justiça.
  Ora, em um mundo percebido culturalmente de maneiras distintas, por indivíduos afetados e atravessados pelas mais diversas experiências, não é possível que se pretenda dizer o direito apenas por meio de visão unidimensional dos fatos.
Uma decisão judicial, além de trazer fundamentos legais e jurídicos, carrega consigo elementos que dizem respeito ao meio social ao qual pertence o julgador, bem como ao momento e os processos históricos pelos quais passou. Desse modo, pensar em realização da justiça é pensar na composição plural dos cargos da magistratura, para que o direito seja dito por intermédio de percepções sobre o mundo advindas de indivíduos com diferentes vivências, com diferentes perspectivas, partindo de diferentes lugares dentro da sociedade.
Pretende-se uma Justiça composta por homens e mulheres que possuam formas diversas de ver, sentir e compreender a vida, provocando um novo arranjo nas estruturas, com decisões efetivas, que dialoguem com as necessidades e especificidades de todos, evitando-se a reprodução de desigualdades.
Quando pauto a composição plural da magistratura e das demais carreiras jurídicas como condição de realização da justiça, colocando em evidência minha negritude dentro do Poder Judiciário, pretendo demonstrar que seus cargos não possuem destinatário certo. Tal conduta implica em ser espelho, importa em proporcionar o reconhecimento de negras e negros no exercício de funções que encaminham os destinos da nossa sociedade.
Apontar o reconhecimento como fundamental nesse processo é proporcionar ao indivíduo, que se vê representado nas esferas de poder,  a construção de sua identidade sentindo-se apto, capaz, com autoestima que poderá colocá-lo lá no futuro. De outro modo, também leva esse indivíduo a entender-se como pertencente àquele espaço, o que confere respeito e confiança à própria instituição.
Tomo, também, como prioridade a vocalização das demandas da população negra, visto que o exercício da magistratura não retira do indivíduo sua condição de cidadão. Assim, se tenho voz, ela deve ser expressão do grupo social ao qual pertenço. Sou mulher negra – esse o lugar de onde parto.
Não sou de uma raça que é vista e compreendida como neutra e, portanto, não posso silenciar às situações de exploração, exclusão e racismo que assisto enquanto cidadã.Não silencio às mortes que reputo injustas, ao extermínio de jovens negros, à violência contra mulheres negras. Vivemos o século XXI e no Brasil ainda há trabalhos para negros e trabalhos para brancos, há espaços para negros e espaços para brancos. Não é mais possível que isso não nos surpreenda!
Penso que o Judiciário e a sociedade como um todo precisam entender que o que faz negros e negras serem pobres é o racismo, e não o contrário; precisam discutir todas as complexidades, ambiguidades e contradições das relações sociais; precisam compreender os processos excludentes e opressivos, praticados e vividos ao longo dos anos, nas mais diferentes áreas, privando negros e negras do direito à educação, ao voto, ao acesso à moradia, a condições dignas de vida e à própria justiça.
Acredito que transformações somente poderão ocorrer por intermédio de inclusão de pautas antirracistas em todas as esferas de poder, com ampla participação da população, construindo-se políticas públicas de solidariedade, para que os descendentes de escravizados efetivamente emancipem-se.
Nesse sentido, apenas um Judiciário com composição plural estará apto a deter a confiança e respeito do povo, o que é  imprescindível na dinâmica das relações sociais, no fortalecimento da democracia e na luta antirracista.
Hoje, rompido o silêncio, fortalecendo-me na ancestralidade, honrando a todos aqueles que em luta contínua e sem tréguas, com muito sofrimento, opressão, erigiram-me a condição de magistrada, caminho com passos firmes, segura de que é possível fazer com que a sociedade compreenda que o racismo é estrutural e somos corresponsáveis por seu enfrentamento e eliminação.
Nesse sentido, qualquer tentativa de silenciamento da minha fala, converte-se em ato de violência contra mim e contra a essência da própria instituição à qual pertenço.
Quando essas questões forem bem compreendidas estaremos todos lutando do mesmo lado e, um dia, faremos Justiça Social! E, então, um dia não se colonizarão sonhos como quiseram fazer com os meus!
“[…] Então é melhor falar tendo em mente que não esperavam que sobrevivêssemos.”
– Audre Lorde
",Sororidade em Pauta,Uma magistrada negra: história e um Judiciário para além da exceção,"Karen Pinheiro, magistrada negra do Rio Grande do Sul conta sobre os desafios e preconceitos que enfrentou e enfrenta em sua trajetória",2019-03-21 18:34:02
Agência Brasil,https://www.cartacapital.com.br/politica/mpf-pede-que-temer-e-moreira-franco-voltem-para-a-prisao/,"Temer, Moreira Franco e outros acusados foram presos preventivamente no último dia 21, na Operação Descontaminação. Após pedidos das defesas, os acusados foram soltos quatro dias depois, em uma decisão liminar que questionou a fundamentação das prisões, decretadas pelo juiz federal Marcelo Bretas. O  considerou que a decisão de prendê-los não se sustentava por faltar contemporaneidade aos fatos e também porque os acusados não ocupavam mais os cargos em que os crimes teriam sido praticados. Apesar da decisão liminar, os pedidos de habeas corpus serão levados à 1ª Turma Especializada do Tribunal Regional Federal da 2ª Região. As defesas dos acusados negam envolvimento no esquema apontado pelo MPF.Os procuradores que assinam os recursos questionam os motivos que levaram o desembargador a revogar liminarmente as prisões preventivas. O MPF afirma que a decisão antecipou a análise do mérito do pedido de habeas corpus feito pelas defesas, o que, argumentam, deveria ter sido avaliado pela 1ª Turma de desembargadores.“O julgamento monocrático de mérito em favor da parte é circunstância excepcional e rara, pois resulta na indesejável supressão das fases do contraditório prévio e do julgamento colegiado, os quais integram o devido processo legal regular”, diz o MPF.A procuradoria pede que, caso as prisões preventivas não sejam restauradas, Temer e Moreira Franco fiquem em prisão domiciliar, sob monitoramento eletrônico.Além do ex-presidente e do ex-ministro, o MPF recorreu contra a soltura do operador financeiro João Baptista Lima Filho (Coronel Lima), Maria Rita Fratezi, Carlos Alberto Costa, Carlos Alberto Costa Filho, Vanderlei de Natale e Carlos Alberto Montenegro Gallo.Na sexta-feira 29, o Ministério Público Federal apresentou duas denúncias contra Temer, Moreira e mais nove pessoas. A primeira denúncia acusa de , o coronel João Baptista Lima Filho, o almirante Othon Luiz Pinheiro da Silva, Maria Rita Fratezi, José Antunes Sobrinho, Carlos Alberto Costa, Carlos Alberto Costa Filho, Vanderlei de Natale, Carlos Alberto Montenegro Gallo e Carlos Jorge Zimmermann.Na segunda denúncia, Temer, Moreira, coronel Lima, almirante Othon, José Antunes Sobrinho, Maria Rita Fratezi, Carlos Alberto Costa, Carlos Alberto Costa Filho e Rodrigo Castro Alves Neves respondem pela contratação fictícia com a empresa Alumi Publicidades, como forma de dissimular o pagamento de propina de cerca de R$ 1,1 milhão.",Política,MPF pede que Temer e Moreira Franco voltem para a prisão,Decisão do desembargador Ivan Athié foi questionada pelo Ministério Público Federal,2019-04-01 20:38:01
Jônatas Campos,https://www.cartacapital.com.br/dialogos-capitais/dialogos-capitais-eles-querem-privatizar-e-desconstruir/,"A 6ª edição dos Diálogos Capitais, realizada nesta terça-feira 19 no Recife, capital de Pernambuco, foi um alerta sobre os perigos de uma possível privatização dos bancos públicos, principalmente a Caixa Econômica Federal e o Banco do Brasil.
No Estado, 96% do financiamento rural é realizado pelo Banco do Brasil e 86% de todos os financiamentos habitacionais são feitos pela Caixa Econômica Federal.
  O Sindicato dos Bancários de Pernambuco, que abrigou os Diálogos, é velho conhecido do cenário político local. A mesa eclética contou com o jornalista e comentarista Xico Sá, com a advogada e professora de Direito Liana Cirne, com o o professor de Desenvolvimento Econômico da Universidade de Campinas (Unicamp) Luiz Gonzaga Belluzzo e o presidente da Fenae, Jair Ferreira, mediados pelo jornalista Leandro Fortes, diretor da empresa Cobra Criada, parceira de CartaCapital e da Fenae no evento.
Clubes de futebol, habitação, pequenos municípios, pequenos negócios, programas sociais, projetos culturais e futuro de programas como o Bolsa Família foram temas do debate. Todos relacionados com os bancos públicos. Jair Ferreira apresentou dados importantes sobre a importância dos bancos públicos para Pernambuco, cenário que se repete em números parecidos nos Estados nordestinos.
Xico Sá arranca risadas de seus companheiros de palco (Foto: Rodrigo Ramos)“Pernambuco tem 17 bancos. Destes, quatro são públicos. Mas quando você vai para o interior, 53% das agências bancárias estão concentradas nos bancos públicos: Caixa, BB e Banco do Nordeste. Se você tirar a Caixa do jogo financeiro em Pernambuco, por exemplo, quem vai fazer financiamento de 20 ou 30 anos?”, questionou Jair.  Belluzzo citou que a história dos planos econômicos brasileiros e o impulso da economia em épocas de crise sempre tiveram os bancos públicos como líderes da expansão do crédito. E lembra que toda vez que um governo tinha problemas na economia, “convocava uma reunião com a Caixa e o BB”.
  O economista e articulista de CartaCapital teceu duras críticas ao governo Bolsonaro, chamando-o de “primata” e com “déficit de civilidade”. “Eles querem privatizar e desconstruir toda a estrutura e articulação do sistema financeiro que repousa sob os bancos púbicos”, disse.
Para Belluzzo, a burocracia bolsonarista não conhece a importância do Bolsa Família para as pequenas cidades e a importância da economia local garantida por esses depósitos sociais.
Xico Sá lembrou de fatos cotidianos que devem ser comunicados para exemplificar a importância dos programas dos bancos públicos. “Um tio meu de Santana do Cariri dizia que o capitalismo começou em sua cidade com o Bolsa Família, quando começou a vender um quilo de arroz, a matar um bode para vender.”
Para ele, muitas cidades saíram da condição da “prática de escambo” para passar a operar com moeda. “A crônica social é muito bonita, comovente. O sorriso de quem não tinha sorriso”, alegrou-se.  A professora Liana Cirne questionou “como comunicar a sociedade civil o que nós estamos enfrentando”. Ela lembrou que a defesa dos bancos públicos passa pela conscientização das pessoas de que as instituições são empresas cujo objetivo primordial é prestar serviço e não necessariamente obter lucro.
“Eles podem ter prejuízo financeiro, desde que esse prejuízo seja em benefício da população”, opinou.
Após a participação do plenário, os palestrantes fizeram suas conclusões. “Esclarecimento, debate, ouvir as pessoas e falar com elas. Convocar as pessoas para ir para a rua”, concluiu Belluzzo.
“Vivemos um período de atrocidades e comunicação de guerra”, resumiu Jair Ferreira. “A gente menosprezou esses malucos com discursos alucinados, enganando parte da população. O importante é não entregar os pontos”, bradou Xico Sá.
Representando as mulheres, Liana Cirne fechou o papo com esperança. “Essa ofensa à inteligência da população tem diminuído o capital político desses caras. Mas temos que transformar nossa comunicação em meme. Como eu acredito na força das ruas, como eu acredito nos congressos, acredito na força de Lula e de Marielle, acredito que temos a possibilidade de destituir esse ‘poder’. Se fizermos isto, não podemos abrir mãos da participação popular em todas as empresas de economia mista do Estado”, disse, aplaudida.
",Diálogos Capitais,Diálogos Capitais: “Eles querem privatizar e desconstruir”,Evento de CartaCapital em parceria com a Fenae reuniu notáveis no Recife e debateu o papel dos bancos públicos na economia,2019-03-20 01:56:21
Thais Reis Oliveira,https://www.cartacapital.com.br/politica/doria-recua-e-devolvera-21-mi-a-projeto-que-ensina-musica-a-criancas/,"O Guri ensina música a 64 mil crianças e adolescentes carentes em todo o Estado de São Paulo. Na sexta-feira 29, funcionários receberam um aviso de que seriam demitidos no próximo mês. Mais da metade dos educadores, músicos e coordenadores de polos foram comunicados.Mais de 60 mil crianças e adolescentes carentes em todo o Estado de São Paulo aprendem música no Projeto Guri (Foto: Ciete Silvério/ Governo do Estado de São Paulo)Professores e alunos foram pegos de surpresa com os cortes. Caso Doria não tivesse recuado, mais de 30 mil vagas seriam cortadas e mais da metade dos 382 pólos estaduais, fechados.O secretário de Cultura, Sérgio Sá Leitão, considerou que a ONG se precipitou no aviso. “Foi uma decisão preventiva, tomada pela organização social porque o aviso prévio dura trinta dias. Mas sempre apontamos nesse ínterim que uma decisão seria tomada”, justificou.Os cortes no Projeto Guri estão ligados a um a congelamento de 148 milhões de reais no orçamento da Secretaria de Cultura e Economia Criativa, equivalente a 23% do borderô total da pasta. Apesar do recuo, a medida continuará em vigor. O governo calcula um déficit de 10,5 bilhões, e promete cortes em outras pastas.O orçamento anual do projeto — mantido por uma organização social — para este ano é de 94,7 milhões. Doria prometeu ainda ampliar o investimento no projeto a partir de 2020, com o patrocínio de empresas privadas. ",Política,Doria recua e devolverá 21 mi a projeto que ensina música a crianças,"Em meio a críticas, o governador voltou atrás e vai manter o Projeto Guri, que atende 64 mil crianças e adolescentes ",2019-04-01 21:03:37
