author,url,text,section,title,sub_title,date
Joanna Burigo,https://www.cartacapital.com.br/diversidade/o-que-o-patriarcado-nos-ensina-sobre-as-mentiras-de-bolsonaro/,"A matéria sobre as declarações estapafúrdias do  acerca da localização político-ideológica do nazismo foi publicada antes mesmo que o presidente Jair Bolsonaro contundentemente confirmasse o delírio, e situa a origem da vazia polêmica na produção de .
Quando publiquei o termo pela primeira vez, ainda em 2016, expliquei que se  é a palavra que conceitua o emprego de práticas políticas coercitivas,  seria um desdobramento adequado para a política institucional dos nossos tempos e pagos, já temperada na mistura do mal com atraso e pitadas de psicopatia, e sendo forjada pelo desligamento proposital com qualquer traço de realidade.
São de conhecimento público algumas das técnicas características desta fase do acirramento acelerado de um projeto transnacional de poder, que soa como fascismo e tem forma de . Falo de coisas como análise de  aplicada ao emprego das redes sociais para pulverização personalizada de  e , por exemplo. Soa sofisticado, e é mesmo, porém, os termos não deixam de ser uma “gourmetização” das boas e velhas e .
Agindo conforme o legado do gênio da propaganda nazista Joseph Goebbels, muitos dos corpos masculinos e brancos correntemente (e constantemente, e nunca não) ocupando os assentos mais valiosos da política institucional vêm manipulando opinião pública com a repetição de mentiras até que estas se tornem verdades. Esta é uma tática tão velha como parafrasear Nietzsche dizendo que tudo está sujeito a interpretação, e que a que prevalece resulta do poder e não da realidade.  Uma forma notória que o poder tem de manipular e mentir para impor verdades é a propaganda, este termo técnico da teoria da comunicação que nomeia o conjunto de dispositivos simbólicos que implantam ideais como discurso.
Política é disputa, o material da política é o simbólico, e na  estão em jogo sobretudo significados., kit gay e mamadeira de piroca foram apenas três das muitas mentiras que fomentaram o sem-fim de  que sustentaram e ainda sustentam a  em que estamos metidos desde antes que qualquer ideal de democracia tenha sido triturado pela institucionalização, e por eleição, de sujeitos que se valem de mitologia patriarcal para estarem no poder. Terra plana, vacinas causando autismo, globalismo, a doutrinação marxista nas escolas – claramente um resultado do comunismo no Brasil, onde tampouco houve uma ditadura militar – aquecimento global ser invenção, ciência e opinião terem o mesmo valor: foram muitas as mentiras que precederam e moldaram nosso atual estado de coisas.
Bolsonaro parece ainda estar em campanha. Não assume a responsabilidade básica de um chefe de estado, que é governar para todo povo, e ao invés disso fomenta animosidade nas redes sociais entre brasis fabricados. Parece presidente de mentirinha, e mentir ele mente:  que ele deu 132 declarações falsas ou distorcidas nos três primeiros meses de governo.
Não abraço a narrativa de que estamos passando vergonha internacionalmente, não por isso não ser verdade, nem porque não somos os únicos (, mas porque vergonha é o sentimento mais irrelevante que me atravessa nestes tempos em que a catástrofe  é generalizada e veloz. Um salve, então, para nossa competência em fazer a narrativa ao menos soar tragicômica, como no 1º de abril, quando uma das  do Twitter nacional era.  Bolsonaro não mente, no entanto, sobre sua devoção ao mentor , outro mentiroso e . O mesmo Donald Trump que, num passado não tão distante, exigiu publicamente um certificado de nascimento de Barack Obama, esta semana mentiu descaradamente ao dizer que o pai, cria do Bronx, nasceu na Alemanha.
. Podem ser psicopatas ou narcisistas, mas este diagnóstico deixo para especialistas. O que se pode ver, por estar patente como técnica, é a propaganda que empregam para desestabilizar consensos sobre a realidade. Este tipo de tática é comum às instituições patriarcais, precede a , e nem sempre é lida como propaganda – mas minha hipótese é de que é assim que se dá a difusão de valores patriarcais.
A construção narrativa da bruxa, para dar apenas um exemplo, eclipsou a realidade destas serem mulheres independentes e detentoras de saberes medicinais e agrícolas com, digamos,  medievais sobre seres diabólicos operando forças ocultas. E é próprio do pensamento feminista tratar a heterossexualidade e a monogamia não como naturais nem essenciais, mas como criações culturais para a manutenção do poder dos homens, ambas como garantia da manutenção da propriedade pela garantia genética. (E aqui me sinto compelida a fazer uma ressalva: por serem construções culturais, é escorregadio discuti-las pelo viés do desejo, onde são tão válidas quanto outros arranjos de sexualidade consentida e organizações individuais de vida e afeto, mas isso abre outra conversa.)
A base da assim como a base do patriarcado, é fantasiosa. A sustentação de ambos não requer compromisso com a realidade. Pelo contrário: é absolutamente indispensável algum desligamento dela.
Mentiras e manipulação sobre quem vive realidades diferentes de qualquer que seja a narrativa de interesse do poder são excelentes modos de justificar sua aniquilação.Se a narrativa é fantasiosa, é compreensível que mentiras e manipulação sejam fundamentais para sua manutenção. Existe uma lógica aí. É perversa, mas é uma lógica. Por exemplo, se a fantasia é que “lugar de mulher é no lar”, a mentira naturalizada é de que a culpa é dela se sofrer consequências de não estar no lar. Se a bruxa é maligna, fica justificado livrarmo-nos delas. Se o nazismo é de esquerda, tudo bem aniquilar esquerdistas.
O absurdo argumento de que nazismo é de esquerda é como a fantasiosa sugestão de que bruxas voam em vassouras: são proferidas como discurso oficial para efeitos de manipulação da realidade. É surrealismo, e como o surrealismo tende a ser, é fabricado.
Na , tanto ou mais do que disputar verdades sobre sentidos, é importante compreender os jogos onde o sentido é a própria essência da disputa. Alguns jogos não se jogam. Mais vale revelar seus tabuleiros, identificar seus  e interceptar suas regras injustas. Por enquanto eles venceram. Mas o sinal não está fechado para abrirmos o jogo.
",Diversidade,O que o patriarcado nos ensina sobre as mentiras de Bolsonaro,"Se a narrativa é fantasiosa, é compreensível que mentiras e manipulação sejam fundamentais para sua manutenção",2019-04-04 17:30:11
Thais Reis Oliveira,https://www.cartacapital.com.br/politica/lavagem-de-dinheiro-por-apartamento-torna-temer-reu-pela-terceira-vez/,"A denúncia havia sido oferecida há dois dias pelo Ministério Público Federal em São Paulo e está no bojo da Operação Descontaminação, que investiga desvios na Eletronuclear — e motivou a     De acordo com os procuradores, o apartamento de Maristela teve uma reforma de 1,6 milhão paga com dinheiro de propina da Engevix, por intermédio do Coronel Lima e de Maria Rita. A empresa teria se beneficiado de contratos com Angra III, em obras há 35 anos.
A Lava Jato afirma que as obras ocorreram entre 2013 e 2014 e foram bancadas com dinheiro de corrupção e desvios que teriam ocorrido entre 2012 e 2016. O caso tramitava no Supremo Tribunal Federal (STF) e foi remetido para São Paulo em janeiro, depois que Temer perdeu o foro especial ao deixar a Presidência.    É a terceira vez que Temer ganha um passe para o banco dos réus desde que foi preso. Há dois dias, o juiz Marcelo Bretas acatou duas denúncias do MPF do Rio de Janeiro contra o ex-presidente por corrupção, lavagem de dinheiro e peculato no caso da Eletronuclear.
No dia 28, a justiça de Brasília o tornou réu por corrupção passiva no caso da  A denúncia existe desde 2017, mas só se tornou ação penal depois que ele perdeu o foro especial.
",Política,Lavagem de dinheiro por apartamento torna Temer réu pela terceira vez,"Filha do ex-presidente, o coronel Lima e a esposa dele, Maria Rita Fratezi, também serão processados",2019-04-04 20:34:55
Redação,https://www.cartacapital.com.br/politica/apos-gafe-de-moro-conge-ganha-definicao-no-dicionario-informal/,"Alguém me explica o que é :
“CONGE”
“agir SOBRE a violenta emoção….”
“VIM a ser condenada”
Esse é o fino português do exemplar de Juiz da república de Curitiba
“In dubio PAU no réu”    — Walter (@WalterAugustoF) 
Com a chancela ministerial do superministro, o termo foi adicionado ao Dicionário Informal, site que define palavras não encontradas no vocabulário tradicional. “Uma iniciativa de documentar on-line a evolução do português”, diz a definição do portal.  
Na comissão do Senado, Moro voltou a defender o endurecimento das punições a crimes de corrupção e a crimes contra a vida, foco do pacote anticrime apresentado por ele ao Congresso em fevereiro.
",Política,"Após gafe de Moro, “conge” ganha definição no Dicionário Informal",O ex-juiz da Lava Jato deu uma escorregada no Português ao pronunciar a palavra cônjuge durante sessão na CCJ do Senado,2019-04-04 16:31:56
Thais Reis Oliveira,https://www.cartacapital.com.br/politica/5-meias-verdades-ditas-por-guedes-ao-explicar-a-reforma-da-previdencia/,"Em um primeiro momento, Guedes se concentrou na capitalização, embora o assunto não conste no texto que o governo enviou aos deputados. Segundo ele, o atual modelo de repartição — em que os trabalhadores ativos financiam a aposentadoria dos inativos — é “um avião sem gasolina partindo para alto mar com várias bombas”.
A solução, segundo ele, é que o trabalhador banque a própria aposentadoria, e sem contribuição dos empresários. Para evitar que uma massa de brasileiros chegue à velhice sem recursos, admitiu a criação de uma camada de repartição, que vai complementar a renda de quem receberia menos de um salário mínimo.
Mais tarde, questionado por deputados, explicou alguns pontos controversos. Para os deputados da oposição, Guedes não conseguiu provar a necessidade de sua reforma e falhou ao justificar medidas consideradas cruéis, como a mudança no BPC e aposentadoria rural.  Confira alguns argumentos discutíveis do ministro.

Guedes usou esse exemplo para rebater a tese de que a reforma aprofunda as desigualdades de gênero. É verdade que a maioria dos pobres se aposenta por idade: aos 61,7 anos, em média, e ganha até um salário mínimo. Mas a reforma piora a vida deles exigir um mínimo de 20 anos de contribuição.
O caso das professoras também é dramático. Uma docente da rede pública que esteja a nove meses para se aposentar, pela reforma, só poderia fazê-lo em 11 anos.  Mais da metade dos brasileiros já não consegue hoje comprovar 15 anos, difícil imaginar que essa taxa melhore em um cenário de informalidade crescente.
O “corte de privilégios” é mais retórico do que prático: 83% da economia prometida trilionária pelo ministro virá do regime geral, do Benefício de Prestação Continuada e no fim do abono salarial.

Foi incluído na PEC um mecanismo que libera mudanças na idade mínima, cálculo do benefício e tempo de contribuição via Lei Complementar, e não mais pela Constituição. Essa mudança é uma das mais criticadas pelos deputados, que acusam o governo de colocar em risco os direitos sociais já conquistados.  A interpretação de Guedes é bastante questionável porque, na prática, esse mecanismo facilita a tramitação desses pontos. Para alterar uma norma constitucional são necessários 3/5 da maioria (308 na Câmara e 49 no Senado, ambos em dois turnos). Já as leis complementares passam com bem menos votos (257 em dois turnos no Congresso e 41 no Senado, em turno único).
Pedro Serrano, professor de Direito Constitucional da PUC-SP, explica que, se um direito é desconstitucionalizado, ele deixa de estar acima de qualquer discussão majoritária.

Guedes admite que sua capitalização não prevê um centavo de contribuição patronal pelos próximos vinte anos. De outro lado, o sistema só será oferecido a quem entre no mercado de trabalho depois de uma eventual aprovação. Essa diferenciação favorece uma contribuição predatória entre os recém-chegados e os novatos no mercado, e restringe as opções dos mais novos. Entre contratar um trabalhador alguns anos mais velho que contribui para o regime geral e outro, recém-chegado, que tenha aderido à capitalização, qual é a escolha mais vantajosa?

Guedes considera o atual modelo uma das causas do desemprego, e por isso sugere o fim das contribuições patronais. O que quebra a Previdência, na verdade, é a informalidade. Se cada vez menos pessoas contribuem para o INSS, menor será a arrecadação. O IBGE estima hoje que 40 milhões de brasileiros em idade produtiva estejam foram do mercado. A reforma trabalhista, além de não cumprir a prometida alta nos empregos, tampouco favorece a Previdência.
Outro meio possível de atacar o problema é cobrando os devedores contumazes. O governo calcula que haja 2 trilhões de reais a receber. “Mas tem muitas empresas que já morreram. Nossa equipe afunilou isso e acabou chegando a 16 mil devedores contumazes, e isso reduziu a uns 37 milhões”, disse o ministro.
Além disso, a Previdência sustenta um amplo esquema de distribuição de renda. Mais de 80% dos municípios brasileiros depende economicamente das pensões e programas sociais.

Uma das maiores críticas ao modelo de capitalização é o risco de entregar a Previdência brasileira aos bancos. Guedes discorda, e explicou na CCJ que o sistema seria gerido por instituições independentes, em um modelo. Não é bem assim. O , professor da Universidade do Chile e especialista em Previdência, explica que os fundos de pensões chilenos, embora cuidem exclusivamente das aposentadorias, pertencem a grandes  financeiras.
Além de empobrecer idosos, o modelo pinochetista não trouxe a riqueza prometida — do fundo de 200 bilhões de dólares em recursos poupados pelos trabalhadores, quase 3/4 do PIB do país, cerca de 40% estão investidos no exterior.
",Política,5 meias verdades ditas por Guedes ao explicar a reforma da Previdência,"Desigualdade de gênero, capitalização e entrega aos bancos: pontos em que o ministro complica, mas não explica",2019-04-03 23:38:28
Redação,https://www.cartacapital.com.br/educacao/velez-diz-que-1964-nao-foi-golpe-e-prega-revisionismo-nas-escolas/,"Segundo o jornal, Vélez diz acreditar que a mudança de regime, há 55 anos, não foi um golpe e sim uma “mudança de tipo institucional”. Além disso, teria dito que o período que seguiu a posse do general Castello Branco não seria ditadura, e sim um “regime democrático de força”. A tese é refutada por historiadores que estudaram o período.
Vélez disse, ainda segundo o , que as mudanças em livros didáticos seriam “progressivas”, e devem ocorrer “na medida em que seja resgatada uma versão mais ampla da história”. Ele ainda teria dito que o papel do Ministério da Educação (MEC) é “regular a distribuição do livro didático e preparar o livro didático de tal forma que as crianças possam ter a ideia verídica, real, do que foi a sua história”.
Não é a primeira vez que membros do governo propõem uma revisão da história. Em janeiro, o próprio presidente Jair Bolsonaro (PSL) e um dos seus filhos, Eduardo Bolsonaro (PSL), escreveram em rede social: “Um povo sem memória é um povo sem cultura, fraco. Se continuarmos no nosso marasmo os livros didáticos seguirão botando assassinos como heróis e militares como facínoras.”  Envolto em polêmicas, o Ministério da Educação , dividido entre os técnicos, vindo em boa medida do Centro Paula Souza, e indicados da ala militar e do guru do presidente, Olavo de Carvalho.
A notícia repercutiu mal entre representantes de editoras e autores de livros didáticos.
",Educação,Vélez diz que 1964 não foi golpe e prega revisionismo nas escolas,Ministro da Educação afirmou que livros didáticos terão ‘versão mais ampla da história’ ,2019-04-04 14:07:53
Fernanda Orsomarzo,https://www.cartacapital.com.br/opiniao/independencia-funcional-ou-morte/,"







  
Dentre os pressupostos do regime democrático inaugurado pela Constituição de 1988, tem-se a previsão de uma magistratura independente e imparcial. Ora, sendo o Poder Judiciário guardião último dos direitos e garantias fundamentais, revela-se de especial importância que seus membros sejam independentes em suas convicções, assegurando-se o acesso do cidadão a uma ordem jurídica justa, imune a eventuais pressões ou interesses externos.
Portanto, a garantia de independência do Poder Judiciário não constituiu privilégio dos juízes, mas prerrogativa popular. Noutras palavras, a decisão devidamente fundamentada com base na convicção do magistrado da causa e em observância às obrigações inerentes ao cargo deve ser respeitada enquanto conquista democrática, o que não impede sua revisão por meio de recurso próprio. Violar a autonomia do julgador em dizer o direito ao caso concreto significa violar o próprio Estado Democrático de Direito.
Não há como aceitar que a judicatura seja intimidada pelo raso discurso do senso comum, incapaz de perceber que no mundo real a lógica simplista “bem x mal” não é suficiente para a resolução de conflitos. O julgar, quando feito com responsabilidade e maturidade, extravasa essa noção. A vida é complexa e demanda a análise de inúmeras circunstâncias e particularidades, não sendo possível encaixar indivíduos em módulos pré-concebidos e fabricados de acordo com uma única visão de mundo.
Ministro Celso de Mello

Após quase cinco anos de magistratura, constato que poucas foram as vezes em que dúvidas não acompanharam meu dia-a-dia. Elas – as dúvidas – me perseguem durante todo o tempo, aparecendo, acreditem, até mesmo em sonho. A responsabilidade do julgar o próximo pesa nos ombros e demanda reflexão constante. Durmo com muitas dúvidas sobre a melhor forma de dizer o direito em casos que aguardam minha análise. Mas jamais durmo com medo. O dia em que sentir receio do julgar, a magistratura estará morta em mim.
",Opinião,Independência funcional ou morte,São constantes os episódios envolvendo ataques pessoais quando a decisão prolatada destoa do que o clamor popular espera,2019-04-03 13:15:55
