author,url,text,section,title,sub_title,date
Redação,https://www.cartacapital.com.br/politica/stf-bloqueia-bens-de-aecio-neves-por-suspeita-de-corrupcao/,"O placar foi de três votos a dois pelo bloqueio dos bens. Em maio de 2018, o pedido da PGR foi negado pelo relator do caso, ministro Marco Aurélio Mello. A procuradoria recorreu e levou a discussão para a Primeira Turma, mas a análise do caso foi interrompida duas vezes por pedidos de vista.
    “Dos termos da denúncia se extrai, claramente, a certeza da materialidade do crime de corrupção passiva e indícios robustos de sua autoria por parte de Aécio e Andrea Neves”, disse no pedido a procuradora-geral da República, Rachel Dodge.  Nesta ça-feira 12, votou o ministro Luiz Fux, que concedeu em parte o bloqueio, assim como os ministros Luís Roberto Barroso e Rosa Weber. A PGR havia pedido o arresto de outros R$ 4 milhões a título de reparação de danos morais coletivos, mas os ministros concederam apenas o bloqueio de R$ 1,6 milhão de cada um dos acusados, referentes à multa em caso de condenação.
Além do relator, Marco Aurélio, votou por negar o bloqueio o ministro Alexandre de Moraes. Para eles, não há indícios de que os acusados tentam evadir o patrimônio de modo a impedir o ressarcimento em caso de condenação.
No processo, Aécio Neves também é acusado de obstrução da justiça por tentar impedir as investigações da Operação Lava Jato.  Durante o julgamento, as defesas de Aécio e Andrea Neves sustentaram que a medida é desnecessária e ilegal, entre outras razões porque o valor estipulado para o bloqueio teria sido arbitrário, baseado em suposições sobre crimes não comprovados e sem fundamentação em perícias.
“Há de existir algum indício que autorize a crença de que a pessoa, o acusado, está dissipando bens”, disse o advogado Alberto Toron, que representa Aécio. “O pedido feito pela PGR não aponta um único ato na linha da dissipação de bens”, afirmou.
",Política,STF bloqueia bens de Aécio Neves por suspeita de corrupção,"O tucano é acusado de receber R$ 2 milhões em propina do empresário Joesley Batista, do grupo J&F, em troca da atuação política ",2019-03-12 21:08:05
Redação,https://www.cartacapital.com.br/politica/apos-prisoes-delegado-do-caso-marielle-sera-afastado/,"Chefe da Delegacia de Homicídios do Rio de Janeiro, Giniton Lages foi o responsável pela investigação que , suspeitos do assassinato de Marielle e do motorista dela, Anderson Gomes.
Em entrevista coletiva, Giniton disse que a prisão dos executores finalizava a primeira parte da investigação. “O caso ainda está em aberto. Estamos entregando a primeira fase, e a segunda ainda está em andamento”, disse o delegado, ressaltando que a investigação para descobrir os mandantes do crime ainda estava em curso.
  Segundo o texto de Lauro Jardim, o chefe da Polícia Civil, delegado Marcus Vinícius Braga, indicará na semana que vem o encarregado da segunda etapa da investigação, centrada em descobrir quem mandou matar a vereadora e o motorista.
Mais tarde, o governador do Rio, Wilson Witzel (PSC) disse, segundo reportagem do G1, que o delegado deixaria a função para fazer um intercâmbio de estudos na Itália. Witzel afirmou que o delegado não será exonerado e que ele foi convidado para um curso de quatro meses fora do Brasil. Ainda de acordo com a matéria do G1, o governador explicou que o Lages estava “esgotado” e que “acumulou muita informação” durante a investigação do caso Marielle.  Aos jornalistas, Giniton confirmou que a filha do sargento reformado da PM, Ronnie Lessa, que efetuou os disparos, namorou o filho mais novo de Jair Bolsonaro. Lessa e Bolsonaro são vizinhos no condomínio Vivendas da Barra, na Barra da Tijuca, zona oeste do Rio, onde o acusado foi preso.
Em entrevista, Bolsonaro colocou em dúvida o trabalho feito pela polícia e o Ministério Público na prisão do sargento reformado Ronnie Lessa e do ex-policial Élcio Vieira de Queiroz. “Espero que realmente a apuração tenha chegado de fato a quem foram os executores, se é que foram eles, e a quem mandou matar.”
",Política,"Após prisões, delegado do caso Marielle será afastado","Motivo oficial é que o delegado, que deve fazer um intercâmbio na Itália, já cumpriu sua missão",2019-03-13 16:28:49
Deutsche Welle,https://www.cartacapital.com.br/mundo/o-giro-ideologico-internacional-de-bolsonaro/,"As viagens devem contrastar com a estada em Davos na Suíça, na qual o estilo populista de Bolsonaro e falta de uma agenda clara provocaram consternação entre vários participantes do Fórum Econômico Mundial. Desta vez, o presidente dos EUA, Donald Trump, e o primeiro-ministro de Israel, Benjamin Netanyahu, desejam saudar exatamente a visão radical do líder brasileiro e fortalecer uma comunhão ultraconservadora internacional.
  Em 2017, Bolsonaro já havia saudado Trump como exemplo. O americano, por sua vez, chamou em janeiro o brasileiro de “grande novo líder”. Um dos filhos do presidente, o deputado Eduardo Bolsonaro (PSL-SP), chegou a usar um boné com a frase “Trump 2020” durante uma visita aos EUA em novembro, explicitando ainda mais a simpatia da família pelo “trumpismo”.  Já Netanyahu chegou a chamar Bolsonaro de “mito” durante a estada no Rio de Janeiro que precedeu a posse do mandatário brasileiro, que – ele mesmo evangélico – compartilha da afinidade de parte dos evangélicos brasileiros com Israel.
Bolsonaro embarcou para os Estados Unidos no domingo 17. A viagem marca um rompimento de uma tradição diplomática do Brasil nas últimas três décadas. Ele é o primeiro presidente da Nova República a optar por fazer sua primeira viagem oficial aos EUA e não à Argentina.
Seu encontro com Trump está marcado para esta terça-feira 19 na Casa Branca. Na pauta de reunião estão previstas discussões sobre a crise na Venezuela e a negociação de acordos de comércio e investimentos e de intercâmbio militar.    Já a visita a Israel está prevista para ocorrer no fim do mês. Entre as duas viagens, Bolsonaro deverá fazer ainda uma visita ao Chile. O presidente não tem tanto em comum com o presidente chileno, Sebastián Piñera, mas o ex-militar e sua equipe econômica veem o país sul-americano como exemplo por causa das reformas executadas pelo ex-ditador Augusto Pinochet nas décadas de 1970 e 1980.
Os problemas de Trump estão diariamente na imprensa americana (Foto: AFP)Apesar da pompa com que as viagens foram anunciadas, Bolsonaro vai visitar seus novos parceiros dos EUA e Israel em um momento delicado. Tanto Trump quanto Netanyahu vêm enfrentando há meses dificuldades políticas internas e problemas legais.
Os problemas de Trump, que diariamente aparecem na imprensa americana, incluem a investigação para apurar uma possível interferência da Rússia nas eleições de 2016 e a possível participação da campanha do republicano num conluio com os russos, suspeitas de fraude envolvendo empreendimentos da Organização Trump e doações, além do pagamento de subornos pelo silêncio de mulheres com quem o presidente teria se relacionado.  Na semana passada, Paul Manafort, ex-chefe da campanha de Trump, foi condenado pela segunda vez por fraude fiscal e bancária e conspiração. No início de março, ele já havia sido condenado por crimes financeiros por um tribunal da Virgínia. As penas de Manafort, que foi preso em 2017, já somam 90 meses de prisão. Ele não é ex-membro do círculo da campanha de Trump com problemas legais.
Em dezembro, o ex-advogado pessoal do presidente, Michael Cohen, já havia sido condenado a três anos de prisão por evasão fiscal, irregularidades no financiamento da campanha e por ter mentido perante um comitê de inteligência do Senado sobre negócios de Trump na Rússia. No final de fevereiro, Cohen também prestou depoimento ao Congresso. 
  Em novembro, será a vez do julgamento de Roger Stone, um conselheiro de longa data de Trump, que é acusado de ter mentido sobre seus esforços para contatar o Wikileaks, o site do ativista australiano Julian Assange, que durante as eleições vazou mensagens de membros do Comitê Nacional Democrata, prejudicando a campanha de Hillary Clinton. O novo julgamento deve continuar a deixar os holofotes em Trump, que já classificou as investigações como “caça às bruxas”.  Além dos problemas legais, Trump também vem entrando em choque repetidamente com o Congresso. Na semana passada, a oposição democrata, junto com alguns senadores republicanos insatisfeitos com Trump, conseguiu derrubar um decreto de emergência nacional do presidente que previa a realocação de recursos federais para construção do muro na fronteira com o México. Trump acabou vetando a resolução que derrubou o decreto, usando pela primeira vez essa prerrogativa em seu governo.
Primeiro-ministro de Israel, Benjamin Netanyahu (Foto: Tânia Rêgo/Agência Brasil)Já Netanyahu enfrenta em Israel uma série de acusações de corrupção e tem uma eleição acirrada pela frente, que vai ocorrer poucos dias depois da viagem de Bolsonaro. No final de fevereiro, o procurador-geral de Israel, Avichai Mandelblit, anunciou que pretende apresentar denúncia criminal contra o premiê.
No momento, Netanyahu é alvo de três investigações. Uma delas envolve a empresa de telecomunicações Bezeq, a maior de Israel, suspeita de ter sido beneficiada pelo governo. Em troca, a empresa teria feito uma cobertura simpática ao primeiro-ministro no site de notícias de uma de suas subsidiárias.
  Os dois outros casos envolvem acusações de que o premiê aceitou presentes de bilionários que somam quase 1 milhão de reais, como charutos e bebidas, e beneficiou um jornal, mais uma vez em troca de cobertura favorável.
Quando visitou o Brasil no fim de dezembro, Netanyahu, que está no comando de Israel há dez anos, já enfrentava dificuldades, tendo sido forçado a antecipar para abril uma eleição geral originalmente prevista para novembro. E quando Bolsonaro tiver deixado Israel, .
O principal adversário de Netanyahu é Benny Gantz, um ex-general, que lidera o novato movimento Branco e Azul (em referência à cores da bandeira israelense). Pesquisas apontam que o movimento deve conquistar cerca de 30 cadeiras no parlamento, a maior fatia entre todos os partidos israelenses.
Por enquanto, as pesquisas também indicam que a coalizão de Netanyahu, que inclui cinco partidos, ainda deve manter uma maioria frágil no parlamento, pouco acima de 60 das 120 vagas.
Nos últimos dias, a revelação de que o Irã, um dos principais inimigos de Israel, teria conseguido invadir o aparelho celular de Gantz foi encarada como benéfica para Netanyahu, mas a imprensa israelense especula que um eventual anúncio da apresentação da denúncia criminal pelo procurador-geral antes das eleições pode novamente colocar a pequena vantagem do premiê em risco.
",Mundo,O giro ideológico internacional de Bolsonaro,Viagem presidencial por EUA e Israel alimenta comunhão ultraconservadora internacional ,2019-03-18 14:43:49
Isa Penna,https://www.cartacapital.com.br/opiniao/bolsodoria-um-desprojeto-de-nacao/,"Paul Krugman, economista liberal e ganhador do prêmio Nobel de 2008 e a revista-bíblia dos liberais respeitáveis, a “” concordam em uma coisa: A próxima grande recessão econômica global está próxima. De outro lado, o capital na sua expressão financeira e de seus governos não recuam das políticas de austeridade que destroem economias nacionais ao redor do planeta, a crise ambiental atinge um novo e mais profundo patamar de gravidade e os direitos sociais dos países de capitalismo central tornaram-se nostálgicos diante das ofensivas sobre o trabalho e os serviços públicos. Para a maioria dos países periféricos as pretensões desses direitos contrastou com expressões da barbárie.
  Diante da eminência de uma próxima grande recessão econômica, há brigas entre o 1% dominante. Vimos como “BolsoDória” apunhalou seu padrinho político, Alckmin, pelas costas para tentar a vaga à presidência pelo PSDB. Há, por exemplo, divergências sobre qual a melhor proposta de reforma da previdência. Alckmin criticou a proposta do governo, enquanto Dória sugere que Bolsonaro aproveite a popularidade para descer goela abaixo uma proposta Draconiana de retirada de direitos e com incentivo aos setores financeiros com o regime previdenciário de capitalização.
A direita paulista sempre buscou protagonismo na condução do país desde a instituição da Republica e, atualmente, Alckmin  Dória mostra a disputa nessa projeção de protagonismo. Dória expressa a essência da ofensiva neoliberal que vivemos, qual seja: o corte de intermediários e o fim de qualquer concessão, inclusive, à direita “tradicional” velha representante das oligarquias locais e nacionais. O estilo “BolsoDória” combina esses elementos e a demagogia cínica que muda de posição entre o centro e a extrema-direita conforme pesquisas de opinião nos temas não diretamente pautados pelo capital; nesses, ele é coerente.
Nesse sentido, o capital expresso no mercado financeiro globalmente organizado está elegendo representantes fiéis ao redor do mundo e inserindo nas estruturas dos estados nacionais lacaios de confiança para aprovarem políticas que ampliem a margem de lucro das grandes corporações.
Não é à toa que Dória passou a maioria de seus dias como prefeito fora do país.A verdade é que ele sequer é representante da elite nacional, mas representa a agenda política das maiores corporações mundiais e segue sendo uma das principais apostas dessa “nova” direita para disputar a presidência em 2022.
No Fórum Econômico Mundial em Davos composto por empresas e executivos de peso, Paulo Guedes e Bolsonaro mencionaram Dória 4 vezes como um dos futuros possíveis presidentes do país e os três, Guedes, Bolsonaro e Dória, discursaram sobre a imprescindibilidade da reforma da previdência para atrair investidores para o país. Dória se elegeu colando sua campanha na de Bolsonaro e estampando camisetas de “Bolsodória”. Bolsonaro se elegeu com uma base sólida e agora é o pivô desse caos político que, generosamente, pode-se chamar de governo.  Agora, meses depois, o governo tutelado pelos militares enfrenta suas primeiras crises políticas: as relações da família de Bolsonaro com as milícias e, possivelmente, com o assassinato da vereadora Marielle Franco; os esquemas de lavagem de dinheiro e seu personagem principal, o motorista Queiroz; as candidaturas femininas laranjas. Soma-se a isso a dificuldade significativa do governo em aprovar a reforma da previdência.
Em São Paulo, Dória tem amplo apoio do agronegócio, promete mandar cidadãos para o cemitério e seu secretariado é composto por 8 dos 11 ministros que assumiram após o impeachment no governo de Michel Temer.Enquanto Bolsonaro é tutelado pelos militares e enfrenta graves crises econômicas, Dória critica a ineficiência do governo em aprovar a reforma da previdência e traz o “” do neoliberalismo para chefiar o Estado de São Paulo.
Não é improvável que Bolsodória tente se afirmar como uma versão alinhada ao “Bolso” original na política e na economia, mas mais eficiente. Tendendo lentamente a se deslocar da base de aliados do governo, visando a disputa presidencial em 2022, nossa tarefa é não deixa-lo esquecer: Uma vez Bolsodória, sempre Bolsodória!
Nesse sentido, opor-se ao governo João Doria não é apenas fazer frente aos retrocessos do governador, e sim resistir a um projeto de país desumano e financista que está cravando seus alicerces em solo paulista. Impedir tal projeto presume nacionalizar a atenção ao risco.
É importante que o Brasil todo conheça a trajetória de traições políticas de Doria e seus resultados. O conjunto do campo progressista brasileiro sabe, ou deveria saber, que antes que Doria construa seu projeto rumo à cadeira de presidente da nação, precisamos agir.
",Opinião, Bolsodória: um Desprojeto de Nação,BolsoDória é mais eficiente do que a versão clássica do bolsonarismo em promover barbáries e retrocessos,2019-03-13 16:22:42
Thais Reis Oliveira,https://www.cartacapital.com.br/politica/marielle-apos-prisoes-entidades-de-direitos-humanos-cobram-desfecho/," De acordo com o MP carioca, o sargento reformado Ronnie Lessa e o ex-PM Élcio Vieira de Queiroz estavam no Cobalt Branco que emparelhou o carro em que a vereadora estava. Lessa teria atirado, e Vieira, dirigia o veículo.    De acordo com os promotores do Grupo de Atuação Especial de Combate ao Crime Organizado (GAECO), o crime foi meticulosamente planejado durante três meses. Lessa fez várias pesquisas na internet sobre os locais que a vereadora frequentava.
A  considerou que a prisão dos suspeitos é “um passo muito importante na elucidação deste grave crime”, mas cobrou do Ministério Público e da Polícia Civil celeridade na identificação dos mandantes e das motivações do crime. “A sociedade precisa saber não só quem apertou o gatilho, mas quem mandou matar e o porquê”, diz a nota divulgada pela organização.    Mas ainda não há respostas sobre quem mandou matar Marielle. Segundo o jornal , o MP e a Polícia concordaram em dividir a investigação em duas partes. Este primeira, transformada em denúncia, identificou os atiradores. A outra, ainda em andamento, deve chegar aos mandantes.
A Anistia Internacional também quer que as investigações avancem, e reafirmou que considera necessária a ação de “um grupo externo e independente de peritos e especialistas para acompanhar as investigações e o processo penal” do caso.    A Conectas falará sobre o caso na 40ª Sessão do Conselho de Direitos Humanos da ONU, que acontece em Genebra, na Suíça. Inicialmente, a equipe falaria sobre o 1 ano da morte de Marielle, mas mudou o texto para incluir os desdobramentos mais recentes do caso.
O PSOL, partido de Marielle, também está empenhado em manter as cobranças sobre o caso. “Não nos cabe insinuar ou apontar mandantes. Nós não seremos levianos. Cabe à Polícia Civil, num prazo imediato, dizer quem são os mandantes”, diz o deputado Marcelo Freixo.    A bancada do partido no Congresso buscará votos para. A ideia, explica Ivan Valente, líder do PSOL, é desvendar as relações entre crime, política e as polícias em nível nacional, em um movimento semelhante à comissão liderada por Freixo em 2008, no Rio de Janeiro
",Política,"Marielle: após prisões, entidades de direitos humanos cobram desfecho","Para a Human Rights Watch, é “preciso saber não só quem apertou o gatilho, mas quem mandou matar e o porquê”",2019-03-12 17:38:51
Alexandre Putti,https://www.cartacapital.com.br/sociedade/freixo-o-caso-nao-esta-resolvido-quem-mandou-matar-marielle/,"  A força-tarefa realizada pela Divisão de Homicídios da polícia e promotores do Ministério Público do Rio de Janeiro prenderam o policial militar reformado Ronnie Lessa e o ex-policial militar Élcio Vieira de Queiroz. Segundo a acusação, eles são os responsáveis pelos disparos contra Marielle e Anderson, no dia 14 de março de 2018.
“O assassinato de uma vereadora é um crime político. Por isso é fundamental sabermos qual grupo político é capaz de, em pleno século XXI, mandar eliminar uma autoridade pública que tenha cruzado seu caminho. Precisamos descobrir quem são os mandantes da execução de Marielle Franco”, disse Freixo.
Os PMs Ronnie Lessa e Élcio Vieira de Queiroz, presos como suspeitos pela morte da vereadora Marielle Franco (Reprodução/ TV Globo)Freixo, quando ainda era deputado estadual no RJ, liderou a CPI das milícias. Em 2008 Marielle era sua assessora e trabalhou junto dele contra as milícias. Em novembro de 2011, Freixo chegou a deixar o País para uma temporada fora após denúncias de que várias milícias estavam planejando o seu assassinato.  Élcio de Queiroz em foto com Jair Bolsonaro: imagem circula cortada nas redes sociais (Reprodução)“Essas pessoas fazem parte de um grupo que todo mundo da área de segurança pública sabe, é chamado de escritório do crime. Porque tem gente que mata a serviço de outros no RJ? Se tivessem feito algo antes, talvez não tivessem matado Marielle e nem tantos outros. É muito grave o que fizeram com a segurança pública do RJ para chegar nesse ponto”, afirmou o parlamentar.
Segundo a denúncia feita pelo Ministério Público do Rio, “é inconteste que Marielle Francisco da Silva foi sumariamente executada em razão da atuação política na defesa das causas que defendia”.
",Sociedade,"Freixo: ‘o caso não está resolvido, quem mandou matar Marielle?’",Dois PMs suspeitos pela morte da vereadora foram presos pela Polícia do Rio nesta terça-feira 12,2019-03-12 13:52:17
